NOME,CITTA,INDIRIZZO,Contatto_1_Tipo,Contatto_1,Contatto_1_Note,Contatto_2_Tipo,Contatto_2,Contatto_2_Note,Contatto_3_Tipo,Contatto_3,Contatto_3_Note,Lunedi_Mattina_Dalle,Lunedi_Mattina_Alle,Lunedi_Pomeriggio_Dalle,Lunedi_Pomeriggio_Alle,Martedi_Mattina_Dalle,Martedi_Mattina_Alle,Martedi_Pomeriggio_Dalle,Martedi_Pomeriggio_Alle,Mercoledi_Mattina_Dalle,Mercoledi_Mattina_Alle,Mercoledi_Pomeriggio_Dalle,Mercoledi_Pomeriggio_Alle,Giovedi_Mattina_Dalle,Giovedi_Mattina_Alle,Giovedi_Pomeriggio_Dalle,Giovedi_Pomeriggio_Alle,Venerdi_Mattina_Dalle,Venerdi_Mattina_Alle,Venerdi_Pomeriggio_Dalle,Venerdi_Pomeriggio_Alle,Google/ID,Google/Link,coorX,coorY
Dott.ssa Vannini Paola Maria,Desio,"Via Achille Grandi, 13 20832 Desio MB","per consigli, informazioni e richieste:",340/2777515,durante l'orario di ambulatorio,Per appuntamento,0362/302155,da lun a ven dalle 08.00 alle 10.00 ,,,,,,15:00,18:30,09:30,13:00,,,,,16:00,19:00,09:30,12:30,,,,,15:30,18:00,ChIJB5IGRiK8hkcRGeCMdoiqooU,https://maps.google.com/?cid=9629446456352759833,45.615052,9.207080
Dott.ssa Urbano Margherita,Desio,"Viale Rimembranze, 8 20832 Desio MB","per consigli, informazioni e richieste:",339.7650372; ,da lun a ven dalle 9 alle 9.40,Per appuntamento,327.9113841,da lun a ven dalle 07.45 alle 9.00,,,,,,14:30,18:00,,,14:30,17:30,10:00,13:00,,,10:00,13:00,,,10:00,12:30,,,,,45.619932,9.206353
Dott.ssa Natale Irene,Desio,"Via Giuseppe di Vittorio, 22 20832 Desio MB",Per appuntamento,0362/355339,da lun a ven dalle 08.00 alle 10.00,"per consigli, informazioni e richieste:",0362/355339,da lun a ven durante l'orario di ambulatorio ,,,,10:30,13:00,,,10:30,13:00,,,,,16:30,19:00,10:30,13:00,,,,,14:15,16:45,,,45.618864,9.193909
Dott. ssa Cajani Maria Rita,Desio,"Via Achille Grandi, 8 20832 Desio MB",Per appuntamento,346 6025148,da lunedì a venerdì dalle 8 alle 10,per visite a domicilio:,346 6025148,da lun a ven dalle 8 alle  10,per consigli:,346 6025148,da lun a ven dalle 8 alle 10,,,14:30,17:30,10:00,13:00,,,,,14:30,17:30,,,16:00,19:00,10:00,13:00,,,,,45.614760,9.207208
Dott Casati Mauro,Desio,"Via Giuseppe Garibaldi, 35 20832 Desio MB",Per appuntamento,0362/301528,da lun a ven dalle 08.00 alle 10.00 ,"per consigli, informazioni e richieste:",0362/301528,da lun a ven durante l'orario di ambulatorio ,,,,09:30,12:30,14:00,16:00,09:00,13:00,,,,,14:00,18:00,09:00,13:00,,,,,14:00,18:00,ChIJuX9V_CK8hkcRlcwHBE1sh7o,https://maps.google.com/?cid=13440830690946436245,45.616149,9.206877
